{
  "experiment": "ckg-bench-smoke",
  "golden_set": {
    "source": "golden-set/index.yaml",
    "ids": ["G01", "G05"],
    "buckets": []
  },
  "methods": ["M1_raw", "M2_graph_full", "M3_incremental", "M4_get_for_task"],
  "driver": "claude_cli",
  "go_stablenet_root": "../go-stablenet",
  "sha_pin": "9978930ba",
  "batch_size": 8,
  "output_dir": "",
  "driver_config": {
    "claude_bin": "claude",
    "claude_cli_timeout": 120
  },
  "cks_config": {
    "health_check": false
  }
}
