{
  "experiment": "ckg-bench-m1fair",
  "golden_set": { "source": "golden-set/index.yaml", "ids": [], "buckets": [] },
  "methods": ["M1_fair"],
  "driver": "claude_cli",
  "go_stablenet_root": "../go-stablenet",
  "sha_pin": "9978930ba",
  "batch_size": 200,
  "output_dir": "",
  "driver_config": { "claude_bin": "claude", "claude_cli_timeout": 600 },
  "cks_config": { "health_check": false }
}
